{
  "schemaVersion": 1,
  "capabilityId": "REPRESENTATIVE_WALLETS_REFERENCE_FINANCE",
  "problem": {
    "statement": "Client, partner, captain and field actors need one authenticated and operator-context-isolated read-only view of their WLT-owned wallet, balances and ledger references through DSH BFF, while finance operators need permission-scoped lookup without transferring financial ownership to DSH or any frontend.",
    "affectedActors": ["client", "partner", "captain", "field", "operator"],
    "frequency": "continuous",
    "severity": "critical"
  },
  "actors": [
    {"id":"client","role":"Authenticated customer reading only their own operator-context-bound wallet and ledger references","permittedActions":["read own wallet status","read own available pending and held balances","read own ledger references","refresh"],"forbiddenActions":["select another actor id","select operator context","mutate balance","append ledger entries","call WLT directly"]},
    {"id":"partner","role":"Authenticated partner reading only their own operator-context-bound wallet and reference finance","permittedActions":["read own wallet","read own ledger references","read own settlements commissions and payouts","refresh"],"forbiddenActions":["derive wallet balance from settlements","use a hardcoded partner id","select operator context","mutate balance in DSH","read another partner wallet"]},
    {"id":"captain","role":"Authenticated captain reading their operator-context-bound wallet, earnings references, payouts and COD liability","permittedActions":["read own wallet","read own ledger references","read own commissions and payouts","submit governed payout request","perform authorized COD handoff actions"],"forbiddenActions":["read another captain wallet","read another operator-context wallet","mutate balance","complete payout locally","call a provider directly"]},
    {"id":"field","role":"Authenticated field actor reading their operator-context-bound wallet, commissions, ledger and payout requests","permittedActions":["read own wallet","read own commissions","read own ledger references","read and submit own payout requests","refresh"],"forbiddenActions":["supply beneficiary identity","select operator context","request more than available balance","mutate wallet balance","read another field actor wallet"]},
    {"id":"operator","role":"Permission-scoped finance operator reading representative wallets and ledger references inside the operator context resolved by Identity","permittedActions":["lookup a supported actor wallet in own operator context","filter ledger by actor in own operator context","inspect reference commissions settlements and payouts","audit correlation and update timestamps"],"forbiddenActions":["lookup without finance.read","supply or override operator context id","read another operator-context wallet or ledger","mutate wallet balance","use read permission for a money-moving action","treat DSH as financial truth owner"]}
  ],
  "surfaces": [
    {"id":"app-client","required":true,"actors":["client"],"routesOrScreens":["MySpace wallet summary"],"operationIds":["getDshClientOwnWallet","listDshClientOwnLedgerEntries"],"states":["loading","success","empty","suspended","frozen","offline","forbidden","error"],"actions":["refresh","inspect ledger"]},
    {"id":"app-partner","required":true,"actors":["partner"],"routesOrScreens":["partner finance wallet"],"operationIds":["getDshPartnerOwnWallet","listDshPartnerOwnLedgerEntries"],"states":["loading","success","empty","suspended","frozen","offline","forbidden","error"],"actions":["refresh","inspect ledger","open settlement reference"]},
    {"id":"app-captain","required":true,"actors":["captain"],"routesOrScreens":["captain finance wallet"],"operationIds":["getDshCaptainOwnWallet","listDshCaptainOwnLedgerEntries"],"states":["loading","success","empty","suspended","frozen","offline","forbidden","error"],"actions":["refresh","inspect ledger","inspect COD","request payout"]},
    {"id":"app-field","required":true,"actors":["field"],"routesOrScreens":["field finance wallet commissions ledger and payouts"],"operationIds":["getDshFieldOwnWallet","listDshFieldOwnLedgerEntries","listDshFieldOwnCommissions","listDshFieldOwnPayoutRequests","createDshFieldOwnPayoutRequest"],"states":["loading","success","empty","partial","suspended","frozen","offline","forbidden","validation_error","error"],"actions":["refresh","inspect ledger","inspect commissions","submit payout request"]},
    {"id":"control-panel","required":true,"actors":["operator"],"routesOrScreens":["representative wallet lookup","representative ledger lookup"],"operationIds":["getDshRepresentativeWallet","listDshRepresentativeLedgerEntries"],"states":["idle","loading","success","empty","partial","not_found","forbidden","invalid_actor","offline","error"],"actions":["select actor type","enter actor id","lookup","inspect ledger","refresh"]},
    {"id":"backend","required":true,"actors":["client","partner","captain","field","operator"],"routesOrScreens":["DSH actor-scoped finance BFF","WLT operator-context-bound wallet and ledger reads"],"operationIds":["getWltWallet","listWltLedgerEntries","getDshRepresentativeWallet","listDshRepresentativeLedgerEntries"],"states":["authenticated","authorized","operator_context_resolved","unsupported_actor","not_found","wlt_unavailable","success"],"actions":["resolve identity","resolve operator context","scope actor","authorize","proxy read","propagate correlation","fail closed"]},
    {"id":"database","required":true,"actors":["operator"],"routesOrScreens":["wlt_wallets","wlt_ledger_entries","wlt_commissions","wlt_payout_requests"],"operationIds":[],"states":["operator_context_isolated","unique_actor_wallet","append_only_ledger","currency_bound","auditable"],"actions":["enforce operator-context actor lookup","enforce actor uniqueness","preserve ledger lineage","prevent duplicate payout requests"]}
  ],
  "outcome": {
    "statement": "Every representative sees an authenticated operator-context-bound WLT-owned wallet and permission-scoped ledger view through DSH, while operators can inspect supported wallets and matching ledgers only inside their Identity operator context without any DSH or frontend balance mutation path.",
    "primaryMetric": "operator-context and actor-scoped wallet and ledger read coverage across required surfaces",
    "guardrailMetrics": ["cross-operator-context financial disclosure count","cross-actor wallet disclosure count","frontend direct WLT financial read count","DSH wallet balance mutation path count","hardcoded actor identifier count","route-contract drift count"],
    "targetState": "All actor surfaces use canonical Identity and operator-context-scoped DSH reads backed by WLT financial truth."
  },
  "acceptance": {
    "criteria": ["WLT accepts only supported wallet actor types.","DSH derives self-service actor identity and operator context from the authenticated session and never from client-controlled input.","Client partner captain and field have canonical own-wallet and own-ledger routes.","Control-panel lookup requires finance.read and uses Identity-resolved operator context.","WLT repositories scope by operator context before actor type and actor id.","Cross-context wallet and ledger reads fail closed without disclosure.","Balances are rendered from WLT without local derivation.","No DSH or frontend route writes wallet balances or appends ledger truth for this journey.","Human-facing surfaces represent loading empty partial forbidden offline error and retry states."],
    "failureStates": ["cross_context_read","cross_actor_read","unsupported_actor","hardcoded_actor","direct_wlt_browser_call","local_balance_derivation","wallet_mutation_in_dsh","missing_permission","missing_context","stale_financial_display"]
  },
  "invariants": {
    "business": ["WLT is the sole owner of wallet and ledger truth.","DSH is an authenticated and authorized application facade only.","Identity resolves actor and operator context trust.","Every self-service wallet read is scoped to the resolved actor.","Ledger history is append-only financial evidence."],
    "negative": ["No DSH table or handler mutates representative wallet balances.","No frontend calls internal WLT financial routes directly.","No user-facing surface supplies an arbitrary self-service actor id or operator context id.","No operator lookup crosses the Identity operator-context boundary.","No settlement summary is labeled as a wallet balance.","No read permission authorizes a money-moving action."]
  },
  "owners": {
    "productManager": "PRODUCT_MANAGER_AUTHORITY",
    "productOwner": "PRODUCT_OWNER_ACCEPTANCE_AUTHORITY",
    "uxJourneyOwner": "UX_JOURNEY_AUTHORITY",
    "financialTruthOwner": "WLT",
    "applicationFacadeOwner": "DSH",
    "identityTrustOwner": "IDENTITY"
  }
}
